{
  "schema": 1,
  "source": "github:addyosmani/agent-skills",
  "revision": "17214a29c429a19f7a9607f2c06f9d650ea87eb0",
  "decisions": {
    "api-and-interface-design": "merge",
    "browser-testing-with-devtools": "adapter-only",
    "ci-cd-and-automation": "adopt",
    "code-review-and-quality": "merge",
    "code-simplification": "merge",
    "context-engineering": "adapter-only",
    "debugging-and-error-recovery": "merge",
    "deprecation-and-migration": "adopt",
    "documentation-and-adrs": "merge",
    "doubt-driven-development": "recipe-only",
    "frontend-ui-engineering": "adapter-only",
    "git-workflow-and-versioning": "reject",
    "idea-refine": "merge",
    "incremental-implementation": "merge",
    "interview-me": "merge",
    "observability-and-instrumentation": "adopt",
    "performance-optimization": "adopt",
    "planning-and-task-breakdown": "merge",
    "security-and-hardening": "adapter-only",
    "shipping-and-launch": "adopt",
    "source-driven-development": "adapter-only",
    "spec-driven-development": "merge",
    "test-driven-development": "merge",
    "using-agent-skills": "reject"
  },
  "excludedExecutables": [
    "hooks/session-start.sh",
    "hooks/sdd-cache-pre.sh",
    "hooks/sdd-cache-post.sh",
    "hooks/simplify-ignore.sh",
    "skills/idea-refine/scripts/idea-refine.sh"
  ]
}
